{
  "schema_version": "1.0",
  "template": {
    "name": "BytePlus Presentation Template_FEB 2026.pptx",
    "asset_path": "assets/BytePlus Presentation Template_FEB 2026.pptx",
    "sha256": "9d65103b658820e8d06c39d5349f22004237f16f2cbe4c419c34ffbbf9089aa1",
    "size_bytes": 58865382,
    "slide_count": 20,
    "canvas": {
      "aspect_ratio": "16:9",
      "width_px": 1280,
      "height_px": 720,
      "width_emu": 12192000,
      "height_emu": 6858000
    },
    "theme": {
      "name": "BytePlus Brand Colours",
      "colors": {
        "accent1": "#A569FF",
        "accent2": "#1E37FF",
        "accent3": "#37E1BE",
        "accent4": "#FF7F66",
        "accent5": "#00DCFF",
        "accent6": "#002863",
        "dark1": "#000000",
        "light1": "#FFFFFF",
        "brand_blue": "#0066FC"
      },
      "primary_fonts": [
        "Byte Sans Regular",
        "Byte Sans Medium",
        "Byte Sans Bold"
      ]
    },
    "package_parts": {
      "media_count": 171,
      "chart_count": 1,
      "table_slide_count": 0
    }
  },
  "catalog_generation": {
    "date": "2026-09-08",
    "methods": [
      "visual inspection of rendered slide PNGs",
      "structural reconciliation with per-slide layout JSON"
    ],
    "review_model": "gpt-5.6-luna",
    "confidence_scale": "0 to 1; lower values indicate OCR or role ambiguity"
  },
  "slides": [
    {
      "slide_number": 1,
      "layout_name": "Title slide",
      "template_role": "title_slide",
      "title": "Presentation Template",
      "ocr_text": [
        "BytePlus",
        "Master Slides",
        "Presentation Template",
        "Last Updated FEB 2026"
      ],
      "visual_description": "White title slide with a small BytePlus wordmark at upper left, blue section label above a large two-line black title on the left, a large multicolor gradient BytePlus mark on the right, and a soft purple-blue-cyan gradient along the bottom edge.",
      "regions": {
        "header": {
          "bbox": [
            45.17,
            243.69,
            560.23,
            45.51
          ],
          "description": "Blue 'Master Slides' label above the title block at upper left."
        },
        "body": {
          "bbox": [
            45.19,
            129.45,
            1180.1,
            461.73
          ],
          "description": "Large two-line title on the left and gradient BytePlus graphic on the right."
        },
        "footer": {
          "bbox": [
            45.19,
            654.57,
            286.64,
            32.5
          ],
          "description": "Bold update-date text at lower left."
        }
      },
      "primary_colors": [
        "#FFFFFF",
        "#000000",
        "#0066FC",
        "#A569FF",
        "#1E37FF",
        "#00DCFF",
        "#37E1BE",
        "#FF7F66"
      ],
      "editable_elements": [
        "text",
        "image"
      ],
      "usage_guidance": "Use as the deck cover or opening title slide; replace the title, section label, date, and right-side hero artwork while preserving the generous left-right split.",
      "confidence": {
        "ocr": 0.99,
        "role": 0.99
      },
      "notes": [
        "The BytePlus wordmark and bottom gradient are part of the template artwork/background rather than separate text elements."
      ]
    },
    {
      "slide_number": 2,
      "layout_name": "Section Divider",
      "template_role": "section_divider",
      "title": "Section Divider",
      "ocr_text": [
        "01",
        "Section Divider"
      ],
      "visual_description": "Minimal white section-divider slide with a blue '01' followed by a bold black 'Section Divider' label across the middle-left and a soft purple-blue-cyan gradient along the bottom edge.",
      "regions": {
        "header": {
          "bbox": [
            0,
            0,
            1280,
            300
          ],
          "description": "Open white space with no header text."
        },
        "body": {
          "bbox": [
            45.19,
            360,
            654.56,
            58.97
          ],
          "description": "Large section number and divider label arranged horizontally near the vertical center."
        },
        "footer": {
          "bbox": [
            0,
            590,
            1280,
            130
          ],
          "description": "No footer text; only the template's bottom gradient artwork."
        }
      },
      "primary_colors": [
        "#FFFFFF",
        "#0066FC",
        "#000000",
        "#A569FF",
        "#1E37FF",
        "#00DCFF",
        "#37E1BE"
      ],
      "editable_elements": [
        "text"
      ],
      "usage_guidance": "Use to introduce a new major section; update the number and label while retaining the sparse transition treatment.",
      "confidence": {
        "ocr": 0.99,
        "role": 0.99
      },
      "notes": []
    },
    {
      "slide_number": 3,
      "layout_name": "Left-Aligned_Content",
      "template_role": "agenda",
      "title": "In today’s agenda",
      "ocr_text": [
        "In today’s agenda",
        "1",
        "Title",
        "2",
        "Title",
        "3",
        "Title",
        "4",
        "Title",
        "5",
        "Title",
        "6",
        "Title",
        "7",
        "Title",
        "8",
        "Title",
        "BytePlus",
        "3"
      ],
      "visual_description": "Agenda slide with a bold upper-left heading and two columns of four agenda rows. Each row has a purple-to-blue numbered circle followed by a black 'Title' placeholder; the BytePlus logo and slide number sit in the footer.",
      "regions": {
        "header": {
          "bbox": [
            52.24,
            57.09,
            560.23,
            68.35
          ],
          "description": "Bold black agenda heading at upper left."
        },
        "body": {
          "bbox": [
            76.56,
            196.01,
            1101.04,
            345.9
          ],
          "description": "Two agenda columns with four numbered rows each; left column starts at x=76.56 and right column at x=641.04."
        },
        "footer": {
          "bbox": [
            43.91,
            673.86,
            1208,
            25.61
          ],
          "description": "BytePlus logo at lower left and slide number 3 at lower right."
        }
      },
      "primary_colors": [
        "#FFFFFF",
        "#000000",
        "#A569FF",
        "#1E37FF",
        "#0066FC",
        "#00DCFF",
        "#37E1BE"
      ],
      "editable_elements": [
        "text",
        "shape"
      ],
      "usage_guidance": "Use at the start of a presentation to preview up to eight agenda items; replace each 'Title' while keeping the two-column numbered rhythm.",
      "confidence": {
        "ocr": 0.99,
        "role": 0.99
      },
      "notes": [
        "The BytePlus footer logo is visible in the rendered background artwork; the slide number is a separate editable placeholder."
      ]
    },
    {
      "slide_number": 4,
      "layout_name": "Blank slide",
      "template_role": "statement_slide",
      "title": "Value Proposition",
      "ocr_text": [
        "Value Proposition",
        "BytePlus",
        "4"
      ],
      "visual_description": "Sparse statement slide with a single oversized bold black 'Value Proposition' centered horizontally and vertically over a white canvas with the standard bottom gradient; BytePlus logo and slide number are in the footer.",
      "regions": {
        "header": {
          "bbox": [
            0,
            0,
            1280,
            280
          ],
          "description": "Open white space with no separate header."
        },
        "body": {
          "bbox": [
            54.34,
            310.72,
            1171.31,
            98.55
          ],
          "description": "Large centered statement title."
        },
        "footer": {
          "bbox": [
            43.91,
            673.86,
            1208,
            25.61
          ],
          "description": "BytePlus logo at lower left and slide number 4 at lower right."
        }
      },
      "primary_colors": [
        "#FFFFFF",
        "#000000",
        "#A569FF",
        "#1E37FF",
        "#00DCFF",
        "#37E1BE"
      ],
      "editable_elements": [
        "text"
      ],
      "usage_guidance": "Use as a high-impact transition or value-proposition opener; replace the statement with one concise message and avoid adding competing content.",
      "confidence": {
        "ocr": 0.99,
        "role": 0.98
      },
      "notes": [
        "The layout is named 'Blank slide' even though it contains an editable title and footer placeholders."
      ]
    },
    {
      "slide_number": 5,
      "layout_name": "Centered_Content",
      "template_role": "three_column_cards",
      "title": "Header",
      "ocr_text": [
        "Header",
        "1",
        "Title",
        "Text description: Pellentesque habitant morbi tristique senectus et netus et malesuada fames ac turpis egestas.",
        "2",
        "Title",
        "Text description: Pellentesque habitant morbi tristique senectus et netus et malesuada fames ac turpis egestas.",
        "3",
        "Title",
        "Text description: Pellentesque habitant morbi tristique senectus et netus et malesuada fames ac turpis egestas.",
        "BytePlus",
        "5"
      ],
      "visual_description": "Centered three-card layout with a bold centered header, three pale rounded rectangles, purple-blue numbered circles above each card, centered title placeholders, and centered multiline description placeholders.",
      "regions": {
        "header": {
          "bbox": [
            30.72,
            57.09,
            1221.18,
            68.35
          ],
          "description": "Bold centered header across the top."
        },
        "body": {
          "bbox": [
            94.75,
            168.73,
            1089.83,